Rk,Nation,# Players,Min,List
1.0,eng England,259.0,217991.0,"Cole Palmer, Jarrod Bowen, Ollie Watkins, Morgan Rogers, Jacob Murphy, Morgan Gibbs-White, Eberechi Eze, Jamie Vardy, Liam Delap, Declan Rice ..."
2.0,br Brazil,35.0,44884.0,"Matheus Cunha, Bruno Guimarães, João Pedro, Gabriel Martinelli, Murillo, João Gomes, Evanilson, Joelinton, Lucas Paquetá, Gabriel Magalhães ..."
3.0,fr France,26.0,34581.0,"Jean-Philippe Mateta, Maxence Lacroix, William Saliba, Ibrahima Konaté, Lucas Digne, Georginio Rutter, Alphonse Areola, Boubakary Soumaré, Malo Gusto, Lesley Ugochukwu ..."
4.0,nl Netherlands,25.0,38163.0,"Justin Kluivert, Virgil van Dijk, Ryan Gravenberch, Mark Flekken, Bart Verbruggen, Cody Gakpo, Jan Paul van Hecke, Jurriën Timber, Sepp van den Berg, Matthijs de Ligt ..."
,,,,View Complete Nationalities Table
